{"ok":true,"req":"r-0002","op":"issue-access","subject":"~mignes-magtel","group":"nb/managed/nb-3fa9c2","location":"https://sfu.example.com/group/nb-3fa9c2","token":"EXAMPLE-JOIN-TOKEN-NOT-REAL","state":"active","clients":0,"gen":1,"deadline":1790000000,"sfu":"wss://sfu.example.com/ws","participant":"~dolten-dilpun","ice":[{"urls":["stun:turn.example.com:3478"]},{"urls":["turn:turn.example.com:3478?transport=udp","turn:turn.example.com:3478?transport=tcp","turns:turn.example.com:5349?transport=tcp"],"username":"1790000000:example","credential":"EXAMPLE-TURN-CREDENTIAL-NOT-REAL"}],"stun_urls":["stun:turn.example.com:3478"],"turn_urls":["turn:turn.example.com:3478?transport=udp","turn:turn.example.com:3478?transport=tcp","turns:turn.example.com:5349?transport=tcp"],"turn_username":"1790000000:example","turn_credential":"EXAMPLE-TURN-CREDENTIAL-NOT-REAL","access_expires":1790003600,"renew_after":1790001800}
